genre,title,author,pages,unique_key,average_rating,book_description
contemporary,A Broken Bone,by Melinda Leigh (Goodreads Author),90 pages,https://www.goodreads.com/book/show/51092159-a-broken-bone,4.39,"The mysterious death of a local teen leads to a hunt for a killer in the sixth Widow’s Island novella by #1 Wall Street Journal bestselling author Melinda Leigh.

On Widow’s Island, the secrets are dark…and everybody has one. So when Deputy Tessa Black responds to a call about an explosion in a quiet neighborhood, she gets more than she bargained for: the body of a teen who went missing weeks ago.

Until recently, Gavin was living in a reputable foster home. But now that he is found dead—Tessa can’t help but wonder if sinister forces are at play. Who would want to hurt him, and why?

With the help of her partner, Park Ranger Logan Wilde, Tessa tries desperately to decipher what happened to Gavin before another life is cut short. Someone on Widow’s Island knows the explosive truth. Will Tessa find the answers she needs before someone else turns up dead?"
contemporary,American Dirt,by Jeanine Cummins (Goodreads Author),400 pages,https://www.goodreads.com/book/show/45046527-american-dirt,4.31,"También de este lado hay sueños. On this side, too, there are dreams.

Lydia Quixano Pérez lives in the Mexican city of Acapulco. She runs a bookstore. She has a son, Luca, the love of her life, and a wonderful husband who is a journalist. And while there are cracks beginning to show in Acapulco because of the drug cartels, her life is, by and large, fairly comfortable.

Even though she knows they’ll never sell, Lydia stocks some of her all-time favorite books in her store. And then one day a man enters the shop to browse and comes up to the register with a few books he would like to buy—two of them her favorites. Javier is erudite. He is charming. And, unbeknownst to Lydia, he is the jefe of the newest drug cartel that has gruesomely taken over the city. When Lydia’s husband’s tell-all profile of Javier is published, none of their lives will ever be the same.

Forced to flee, Lydia and eight-year-old Luca soon find themselves miles and worlds away from their comfortable middle-class existence. Instantly transformed into migrants, Lydia and Luca ride la bestia—trains that make their way north toward the United States, which is the only place Javier’s reach doesn’t extend. As they join the countless people trying to reach el norte, Lydia soon sees that everyone is running from something. But what exactly are they running to?"
contemporary,Such a Fun Age,by Kiley Reid,310 pages,https://www.goodreads.com/book/show/43923951-such-a-fun-age,3.85,"In the midst of a family crisis one late evening, white blogger Alix Chamberlain calls her African American babysitter, Emira, asking her to take toddler Briar to the local market for distraction. There, the security guard accuses Emira of kidnapping Briar, and Alix's efforts to right the situation turn out to be good intentions selfishly mismanaged."
contemporary,In Five Years,by Rebecca Serle (Goodreads Author),272 pages,https://www.goodreads.com/book/show/50093704-in-five-years,3.86,"Where do you see yourself in five years?

When Type-A Manhattan lawyer Dannie Kohan is asked this question at the most important interview of her career, she has a meticulously crafted answer at the ready. Later, after nailing her interview and accepting her boyfriend's marriage proposal, Dannie goes to sleep knowing she is right on track to achieve her five-year plan.

But when she wakes up, she’s suddenly in a different apartment, with a different ring on her finger, and beside a very different man. The television news is on in the background, and she can just make out the scrolling date. It’s the same night—December 15—but 2025, five years in the future.

After a very intense, shocking hour, Dannie wakes again, at the brink of midnight, back in 2020. She can’t shake what has happened. It certainly felt much more than merely a dream, but she isn’t the kind of person who believes in visions. That nonsense is only charming coming from free-spirited types, like her lifelong best friend, Bella. Determined to ignore the odd experience, she files it away in the back of her mind.

That is, until four-and-a-half years later, when by chance Dannie meets the very same man from her long-ago vision.

Brimming with joy and heartbreak, In Five Years is an unforgettable love story that reminds us of the power of loyalty, friendship, and the unpredictable nature of destiny."
contemporary,Pretty When She Cries,by A. Zavarelli (Goodreads Author),329 pages,https://www.goodreads.com/book/show/54334176-pretty-when-she-cries,4.15,
contemporary,The Christmas Pact,"by Vi Keeland (Goodreads Author), Penelope Ward (Goodreads Author), Andi Arndt (Goodreads Author) (Narrator), Sebastian York (Narrator)",3 pages,https://www.goodreads.com/book/show/48988798-the-christmas-pact,3.65,"Listening Length: 2 hours and 54 minutes

Heat up the holidays with this sizzling new novella from New York Times best-selling authors Vi Keeland and Penelope Ward!

Riley Kennedy’s emails keep getting crossed with her colleague, Kennedy Riley.

The infuriating man forwards them along with his annoying commentary and unsolicited advice. At least she never has to see him in person since they work in different locations…until they come face to face at the office holiday party. As luck would have it, Kennedy turns out to be gorgeous…though still a jerk. Yet somehow he’s able to charm her out on the dance floor—and convince her to participate in his crazy scheme: He’ll go home with Riley for a Christmas party and pretend to be her boyfriend if Riley agrees to be his date to a wedding.

It sounds easy enough. But little by little, the act they’re putting on starts to feel like so much more than a Christmas pact—and Riley’s about to learn there’s more to Kennedy than she ever imagined."
contemporary,Little Fires Everywhere,by Celeste Ng (Goodreads Author),368 pages,https://www.goodreads.com/book/show/51704136-little-fires-everywhere,4.10,
contemporary,The Fault in Our Stars,by John Green (Goodreads Author),313 pages,https://www.goodreads.com/book/show/11870085-the-fault-in-our-stars,4.20,
contemporary,Fangirl,by Rainbow Rowell (Goodreads Author),483 pages,https://www.goodreads.com/book/show/16068905-fangirl,4.05,"A coming-of-age tale of fan fiction, family and first love.

Cath is a Simon Snow fan.

Okay, the whole world is a Simon Snow fan..

But for Cath, being a fan is her life—and she’s really good at it. She and her twin sister, Wren, ensconced themselves in the Simon Snow series when they were just kids; it’s what got them through their mother leaving. Reading. Rereading. Hanging out in Simon Snow forums, writing Simon Snow fan fiction, dressing up like the characters for every movie premiere.

Cath’s sister has mostly grown away from fandom, but Cath can’t let go. She doesn’t want to.

Now that they’re going to college, Wren has told Cath she doesn’t want to be roommates. Cath is on her own, completely outside of her comfort zone. She’s got a surly roommate with a charming, always-around boyfriend, a fiction-writing professor who thinks fan fiction is the end of the civilized world, a handsome classmate who only wants to talk about words... And she can’t stop worrying about her dad, who’s loving and fragile and has never really been alone.

For Cath, the question is: Can she do this? Can she make it without Wren holding her hand? Is she ready to start living her own life? Writing her own stories?

And does she even want to move on if it means leaving Simon Snow behind?"
contemporary,The Hate U Give,by Angie Thomas (Goodreads Author),444 pages,https://www.goodreads.com/book/show/54296715-the-hate-u-give,4.52,"An alternate cover edition for this ISBN can be found here.

Sixteen-year-old Starr Carter moves between two worlds: the poor neighborhood where she lives and the fancy suburban prep school she attends. The uneasy balance between these worlds is shattered when Starr witnesses the fatal shooting of her childhood best friend Khalil at the hands of a police officer. Khalil was"
contemporary,The Perks of Being a Wallflower,by Stephen Chbosky,213 pages,https://www.goodreads.com/book/show/22628.The_Perks_of_Being_a_Wallflower,4.20,
contemporary,Eleanor & Park,by Rainbow Rowell (Goodreads Author),328 pages,https://www.goodreads.com/book/show/15745753-eleanor-park,4.05,
contemporary,To All the Boys I've Loved Before,by Jenny Han (Goodreads Author),355 pages,https://www.goodreads.com/book/show/15749186-to-all-the-boys-i-ve-loved-before,4.15,"To All the Boys I’ve Loved Before is the story of Lara Jean, who has never openly admitted her crushes, but instead wrote each boy a letter about how she felt, sealed it, and hid it in a box under her bed.

But one day Lara Jean discovers that somehow her secret box of letters has been mailed, causing all her crushes from her past to confront her about the letters: her first kiss, the boy from summer camp, even her sister's ex-boyfriend, Josh.

As she learns to deal with her past loves face to face, Lara Jean discovers that something good may come out of these letters after all."
contemporary,Looking for Alaska,by John Green (Goodreads Author),221 pages,https://www.goodreads.com/book/show/99561.Looking_for_Alaska,4.02,
contemporary,Simon vs. the Homo Sapiens Agenda,"by Becky Albertalli (Goodreads Author), Mathilde Tamae-Bouhon (Goodreads Author)",303 pages,https://www.goodreads.com/book/show/19547856-simon-vs-the-homo-sapiens-agenda,4.29,
contemporary,Paper Towns,by John Green (Goodreads Author),305 pages,https://www.goodreads.com/book/show/6442769-paper-towns,3.80,
contemporary,Anna and the French Kiss,by Stephanie Perkins (Goodreads Author),372 pages,https://www.goodreads.com/book/show/6936382-anna-and-the-french-kiss,4.01,
contemporary,Aristotle and Dante Discover the Secrets of the Universe,by Benjamin Alire Sáenz (Goodreads Author),359 pages,https://www.goodreads.com/book/show/12000020-aristotle-and-dante-discover-the-secrets-of-the-universe,4.33,
contemporary,Thirteen Reasons Why,by Jay Asher (Goodreads Author),352 pages,https://www.goodreads.com/book/show/29844228-thirteen-reasons-why,3.92,
contemporary,Me Before You,by Jojo Moyes (Goodreads Author),369 pages,https://www.goodreads.com/book/show/17347634-me-before-you,4.26,"From the #1 New York Times bestselling author of The Giver of Stars, discover the love story that captured over 20 million hearts in Me Before You, After You, and Still Me.

They had nothing in common until love gave them everything to lose . . .

Louisa Clark is an ordinary girl living an exceedingly ordinary life—steady boyfriend, close family—who has barely been farther afield than their tiny village. She takes a badly needed job working for ex–Master of the Universe Will Traynor, who is wheelchair bound after an accident. Will has always lived a huge life—big deals, extreme sports, worldwide travel—and now he’s pretty sure he cannot live the way he is.

Will is acerbic, moody, bossy—but Lou refuses to treat him with kid gloves, and soon his happiness means more to her than she expected. When she learns that Will has shocking plans of his own, she sets out to show him that life is still worth living.

A Love Story for this generation and perfect for fans of John Green’s The Fault in Our Stars, Me Before You brings to life two people who couldn’t have less in common—a heartbreakingly romantic novel that asks, What do you do when making the person you love happy also means breaking your own heart?"
contemporary,If I Stay,by Gayle Forman (Goodreads Author),201 pages,https://www.goodreads.com/book/show/21570677-if-i-stay,3.94,"Librarian note: alternate-cover edition of 9780525421030.

Just listen, Adam says with a voice that sounds like shrapnel.

I open my eyes wide now.
I sit up as much as I can.
And I listen.

Stay, he says.

Choices. Seventeen-year-old Mia is faced with some tough ones: Stay true to her first love—music—even if it means losing her boyfriend and leaving her family and friends behind?

Th"
