genre,title,author,pages,unique_key,average_rating,book_description
contemporary,Spoiler Alert,by Olivia Dade (Goodreads Author),416 pages,https://www.goodreads.com/book/show/50496918-spoiler-alert,3.98,"Olivia Dade bursts onto the scene in this delightfully fun romantic comedy set in the world of fanfiction, in which a devoted fan goes on an unexpected date with her celebrity crush, who’s secretly posting fanfiction of his own. 

Marcus Caster-Rupp has a secret. While the world knows him as Aeneas, the star of the biggest show on TV, Gods of the Gates, he's known to fanfiction readers as Book!AeneasWouldNever, an anonymous and popular poster.  Marcus is able to get out his own frustrations with his character through his stories, especially the ones that feature the internet’s favorite couple to ship, Aeneas and Lavinia. But if anyone ever found out about his online persona, he’d be fired. Immediately.

April Whittier has secrets of her own. A hardcore Lavinia fan, she’s hidden her fanfiction and cosplay hobby from her “real life” for years—but not anymore. When she decides to post her latest Lavinia creation on Twitter, her photo goes viral. Trolls and supporters alike are commenting on her plus-size take, but when Marcus, one half of her OTP, sees her pic and asks her out on a date to spite her critics, she realizes life is really stranger than fanfiction.

Even though their first date is a disaster, Marcus quickly realizes that he wants much more from April than a one-time publicity stunt. And when he discovers she’s actually Unapologetic Lavinia Stan, his closest fandom friend, he has one more huge secret to hide from her.

With love and Marcus’s career on the line, can the two of them stop hiding once and for all, or will a match made in fandom end up prematurely cancelled?"
contemporary,Crazy Stupid Bromance,by Lyssa Kay Adams (Goodreads Author),352 pages,https://www.goodreads.com/book/show/50972370-crazy-stupid-bromance,4.05,"Alexis Carlisle and her cat café, ToeBeans, have shot to fame after she came forward as a victim of a celebrity chef’s sexual harassment. When a new customer approaches to confide in her, the last thing Alexis expects is for the woman to claim they’re sisters. Unsure what to do, Alexis turns to the only man she trusts—her best friend, Noah Logan.

Computer genius Noah left his rebellious teenage hacker past behind to become a computer security expert. Now he only uses his old skills for the right cause. But Noah’s got a secret: He’s madly in love with Alexis. When she asks for his help, he wonders if the timing will ever be right to confess his crush.

Noah’s pals in The Bromance Book Club are more than willing to share their beloved “manuals” to help him go from bud to boyfriend. But he must decide if telling the truth is worth risking the best friendship he’s ever had.

A hacktivist and a cat café owner decode the friend zone in this romantic comedy from the author of Undercover Bromance."
contemporary,The Neil Gaiman Reader: Selected Fiction,by Neil Gaiman (Goodreads Author),752 pages,https://www.goodreads.com/book/show/50358085-the-neil-gaiman-reader,4.54,"An outstanding array—52 pieces in all—of selected fiction from the multiple-award-winning, #1 New York Times bestselling author Neil Gaiman, curated by his readers around the world, and introduced with a foreword by Booker Prize-winning author Marlon James

Spanning Gaiman’s career to date, The Neil Gaiman Reader: Selected Fiction is a captivating collection from one of the world’s most beloved writers, chosen by those who know his work best: his devoted readers. 

A brilliant representation of Gaiman's groundbreaking, entrancing, endlessly imaginative fiction, this captivating volume includes excerpts from each of his five novels for adults —Neverwhere, Stardust, American Gods, Anansi Boys, and The Ocean at the End of the Lane—and nearly fifty of his short stories. 

Impressive in its depth and range, The Neil Gaiman Reader: Selected Fiction is both an entryway to Gaiman’s oeuvre and a literary trove Gaiman fans old and new will return to many times over."
contemporary,Charming as a Verb,by Ben Philippe (Goodreads Author),336 pages,https://www.goodreads.com/book/show/49867239-charming-as-a-verb,4.01,"Henri “Halti” Haltiwanger can charm just about anyone. He is a star debater and popular student at the prestigious FATE academy, the dutiful first-generation Haitian son, and the trusted dog walker for his wealthy New York City neighbors. But his easy smiles mask a burning ambition to attend his dream college, Columbia University.

There is only one person who seems immune to Henri’s charms: his “intense” classmate and neighbor Corinne Troy. When she uncovers Henri’s less-than-honest dog-walking scheme, she blackmails him into helping her change her image at school. Henri agrees, seeing a potential upside for himself.

Soon what started as a mutual hustle turns into something more surprising than either of them ever bargained for. . . .

This is a sharply funny and insightful novel about the countless hustles we have to keep from doing the hardest thing: being ourselves."
contemporary,The Code for Love and Heartbreak,by Jillian Cantor (Goodreads Author),304 pages,https://www.goodreads.com/book/show/48713839-the-code-for-love-and-heartbreak,3.56,"From bestselling author Jillian Cantor comes a smart, edgy update of Jane Austen's beloved classic Emma.

Emma Woodhouse is a genius at math, but clueless about people. After all, people are unreliable. They let you down—just like Emma's sister, Izzy, did this year, when she moved to California for college. But numbers...those you can count on. (No pun intended.)

Emma's senior year is going to be all about numbers, and seeing how far they can take her. When she and George, her Coding Club co-president, are tasked with brainstorming a new project, The Code for Love is born—a matchmaking app that goes far beyond swiping, using algorithms to calculate compatibility. George disapproves of Emma's idea, accusing her of meddling in people's lives. But all the happy new couples at school are proof that the app works. At least at first.

Emma's code is flawless. So why is it that perfectly matched couples start breaking up, the wrong people keep falling for each other and her own feelings defy any algorithm? Emma thought math could solve everything. But there's nothing more complex—or unpredictable—than love."
contemporary,This Is All Your Fault,by Aminah Mae Safi (Goodreads Author),320 pages,https://www.goodreads.com/book/show/46223214-this-is-all-your-fault,3.62,"Set over the course of one day, Aminah Mae Safi's This Is All Your Fault is a smart and voice-driven YA novel that follows three young women determined to save their indie bookstore.

Rinn Olivera is finally going to tell her longtime crush AJ that she’s in love with him.

Daniella Korres writes poetry for her own account, but nobody knows it’s her.

Imogen Azar is just trying to make it through the day.

When Rinn, Daniella, and Imogen clock into work at Wild Nights Bookstore on the first day of summer, they’re expecting the hours to drift by the way they always do. Instead, they have to deal with the news that the bookstore is closing. Before the day is out, there’ll be shaved heads, a diva author, and a very large shipment of Air Jordans to contend with.

And it will take all three of them working together if they have any chance to save Wild Nights Bookstore."""
contemporary,Simmer Down,by Sarah Smith (Goodreads Author),336 pages,https://www.goodreads.com/book/show/44327422-simmer-down,3.57,"In this finger-licking good rom-com, two is the perfect number of cooks in the kitchen.

Nikki DiMarco knew life wouldn’t be all sunshine and coconuts when she quit her dream job to help her mom serve up mouthwatering Filipino dishes to hungry beach goers, but she didn’t expect the Maui food truck scene to be so eat-or-be-eaten—or the competition to be so smoking hot.

But Tiva’s Filipina Kusina has faced bigger road bumps than the arrival of Callum James. Nikki doesn’t care how delectable the British food truck owner is—he rudely set up shop next to her coveted beach parking spot. He’s stealing her customers and fanning the flames of a public feud that makes her see sparks.

The solution? Let the upcoming Maui Food Festival decide their fate. Winner keeps the spot. Loser pounds sand. But the longer their rivalry simmers, the more Nikki starts to see a different side of Callum…a sweet, protective side. Is she brave enough to call a truce? Or will trusting Callum with her heart mean jumping from the frying pan into the fire?"
contemporary,Mistletoe and Mr. Right,by Sarah Morgenthaler (Goodreads Author),400 pages,https://www.goodreads.com/book/show/49169370-mistletoe-and-mr-right,3.78,"How the moose (almost) stole Christmas.

Lana Montgomery is everything the quirky small town of Moose Springs, Alaska can't stand: a rich socialite with dreams of changing things for the better. But Lana's determined to prove that she belongs...even if it means trading her stilettos for snow boots and tracking one of the town's hairiest Christmas mysteries: the Santa Moose, an antlered Grinch hell-bent on destroying every bit of holiday cheer (and tinsel) it can sink its teeth into.

And really...how hard could it be?

The last few years have been tough on Rick Harding, and it's not getting any easier now that his dream girl's back in town. When Lana accidentally tranquilizes him instead of the Santa Moose, it's clear she needs help, fast...and this could be his chance to finally catch her eye. It's an all-out Christmas war, but if they can nab that darn moose before it destroys the town, Rick and Lana might finally find a place where they both belong...together."
contemporary,I Hope You're Listening,by Tom Ryan (Goodreads Author),368 pages,https://www.goodreads.com/book/show/51344270-i-hope-you-re-listening,3.91,"In her small town, seventeen year-old Delia “Dee” Skinner is known as the girl who wasn’t taken. Ten years ago, she witnessed the abduction of her best friend, Sibby. And though she told the police everything she remembered, it wasn’t enough. Sibby was never seen again.At night, Dee deals with her guilt by becoming someone else: the Seeker, the voice behind the popular true crime podcast Radio Silent, which features missing persons cases and works with online sleuths to solve them. Nobody knows Dee’s the Seeker, and she plans to keep it that way.When another little girl goes missing, and the case is linked to Sibby’s disappearance, Dee has a chance to get answers, with the help of her virtual detectives and the intriguing new girl at school. But how much is she willing to reveal about herself in order to uncover the truth? Dee’s about to find out what’s really at stake in unraveling the mystery of the little girls who vanished."
contemporary,"Together, Apart","by Erin A. Craig (Goodreads Author), Auriane Desombre (Goodreads Author), Erin Hahn (Goodreads Author), Bill Konigsberg (Goodreads Author), Rachael Lippincott (Goodreads Author), Brittney Morris (Goodreads Author), Sajni Patel (Goodreads Author), Natasha Preston (Goodreads Author), more…",288 pages,https://www.goodreads.com/book/show/54326427-together-apart,3.93,"A collection of original contemporary love stories set during life in lockdown by some of today's most popular YA authors.

Erin Craig ""delivers"" on a story about a new girl in town and the cute pizza delivery boy, Auriane Desombre captures our hearts with teens communicating through window signs, and Bill Konigsberg takes us along on daily walks with every step bringing us closer to love. There's flirting and romance from Rachael Lippincott, a tale of a determined girl with a mask-making business from Erin Hahn, and a music-inspired love connection from Sajni Patel. Brittney Morris turns enemies to lovers with the help of a balcony herb garden, Jennifer Yen writes an unconventional romance that starts outside a hospital, and Natasha Preston's teens discover each other--and their love story--in a storybook oak tree.

Romantic, realistic, sweet and uplifting, TOGETHER, APART is a collection of finding love in unexpected places during an unprecedented time . . . each with the one thing we all want: a guaranteed happy ending."
contemporary,Everything I Thought I Knew,by Shannon Takaoka (Goodreads Author),320 pages,https://www.goodreads.com/book/show/40857106-everything-i-thought-i-knew,4.01,"A teenage girl wonders if she’s inherited more than just a heart from her donor in this compulsively readable debut.

Seventeen-year-old Chloe had a plan: work hard, get good grades, and attend a top-tier college. But after she collapses during cross-country practice and is told that she needs a new heart, all her careful preparations are laid to waste.

Eight months after her transplant, everything is different. Stuck in summer school with the underachievers, all she wants to do now is grab her surfboard and hit the waves—which is strange, because she wasn’t interested in surfing before her transplant. (It doesn’t hurt that her instructor, Kai, is seriously good-looking.)

And that’s not all that’s strange. There’s also the vivid recurring nightmare about crashing a motorcycle in a tunnel and memories of people and places she doesn’t recognize.

Is there something wrong with her head now, too, or is there another explanation for what she’s experiencing?

As she searches for answers, and as her attraction to Kai intensifies, what she learns will lead her to question everything she thought she knew—about life, death, love, identity, and the true nature of reality."
contemporary,The Truth Project,by Dante Medema (Goodreads Author),400 pages,https://www.goodreads.com/book/show/50496883-the-truth-project,4.38,"Seventeen-year-old Cordelia Koenig was sure of many things going into her last year of high school. For one, she wasn’t going to stress over the senior project all her peers were dreading—she’d just use the same find-your-roots genealogy idea that her older sister used for hers. Secondly, she’d put all that time spent not worrying about the project toward getting reacquainted with former best friend and longtime crush Kodiak Jones who, conveniently, gets assigned as Cordelia’s partner.

All she has to do is mail in her DNA sample, write about her ancestry results and breeze through the rest of senior year. Done, done and done.

But when Cordelia’s GeneQuest results reveal that her father is not the man she thought he was but a stranger who lives thousands of miles away, Cordelia realizes she isn’t sure of anything anymore—not the mother who lied, the life she was born into or the girl staring back at her in the mirror.

If your life began with a lie, how can you ever be sure of what’s true?"
contemporary,Something Happened to Ali Greenleaf,by Hayley Krischer (Goodreads Author),320 pages,https://www.goodreads.com/book/show/50433121-something-happened-to-ali-greenleaf,4.05,
contemporary,You Know I'm No Good,by Jessie Ann Foley (Goodreads Author),320 pages,https://www.goodreads.com/book/show/50496885-you-know-i-m-no-good,4.16,"From Printz Honor winner and William C. Morris Award finalist Jessie Ann Foley comes the story of one girl’s battle to define herself as something other than her reputation.

Mia is officially a Troubled Teen—she gets bad grades, drinks too much, and has probably gone too far with too many guys. But she doesn’t realize how out of control her parents think she is until they send her away to Red Oak Academy, a therapeutic boarding school in rural Minnesota.

While there, Mia starts confronting her painful past, and questions the purpose of Red Oak. After all, if the Red Oak girls were boys, they never would have been treated the way that they are. Amidst the revelations that cause her to question the way that society treats young women, circumstances outside of her control force Mia to discover what happens when she makes herself vulnerable enough to be truly seen by the rest of the world."
contemporary,We Were Restless Things,by Cole Nagamatsu (Goodreads Author),416 pages,https://www.goodreads.com/book/show/50228263-we-were-restless-things,3.30,"From debut author Cole Nagamatsu comes an atmospheric contemporary fantasy about three teens coming of age in the wake of a mysterious death.
Last summer, Link Miller drowned on dry land in the woods, miles away from the nearest body of water. His death was ruled a strange accident, and in the months since, his friends and family have struggled to make sense of it. But Link's close friend Noemi Amato knows the truth: Link drowned in an impossible lake that only she can find. And what's more, someone claiming to be Link has been contacting her, warning Noemi to stay out of the forest.
As these secrets become too heavy for Noemi to shoulder on her own, she turns to Jonas, her new housemate, and Amberlyn, Link's younger sister. All three are trying to find their place—and together, they start to unravel the truth: about themselves, about the world, and about what happened to Link.
Unfolding over a year and told through multiple POVs and a dream journal, We Were Restless Things explores the ways society shapes our reality, how we can learn to love ourselves and others, and the incredible power of our own desires."
contemporary,The Midnight Library,by Matt Haig (Goodreads Author),288 pages,https://www.goodreads.com/book/show/52578297-the-midnight-library,4.28,"Somewhere out beyond the edge of the universe there is a library that contains an infinite number of books, each one the story of another reality. One tells the story of your life as it is, along with another book for the other life you could have lived if you had made a different choice at any point in your life. While we all wonder how our lives might have been, what if you had the chance to go to the library and see for yourself? Would any of these other lives truly be better?

In The Midnight Library, Matt Haig's enchanting new novel, Nora Seed finds herself faced with this decision. Faced with the possibility of changing her life for a new one, following a different career, undoing old breakups, realizing her dreams of becoming a glaciologist; she must search within herself as she travels through the Midnight Library to decide what is truly fulfilling in life, and what makes it worth living in the first place."
contemporary,Anxious People,"by Fredrik Backman (Goodreads Author), Neil Smith (Translator)",341 pages,https://www.goodreads.com/book/show/49127718-anxious-people,4.34,"A poignant, charming novel about a crime that never took place, a would-be bank robber who disappears into thin air, and eight extremely anxious strangers who find they have more in common than they ever imagined

Looking at real estate isn't usually a life-or-death situation, but an apartment open house becomes just that when a failed bank robber bursts in and takes a group of strangers hostage. The captives include a recently retired couple who relentlessly hunt down fixer-uppers to avoid the painful truth that they can't fix up their own marriage. There's a wealthy banker who has been too busy making money to care about anyone else and a young couple who are about to have their first child but can't seem to agree on anything, from where they want to live to how they met in the first place. Add to the mix an eighty-seven-year-old woman who has lived long enough not to be afraid of someone waving a gun in her face, a flustered but still-ready-to-make-a-deal real estate agent, and a mystery man who has locked himself in the apartment's only bathroom, and you've got the worst group of hostages in the world.

Each of them carries a lifetime of grievances, hurts, secrets, and passions that are ready to boil over. None of them is entirely who they appear to be. And all of them—the bank robber included—desperately crave some sort of rescue. As the authorities and the media surround the premises, these reluctant allies will reveal surprising truths about themselves and set in a motion a chain of events so unexpected that even they can hardly explain what happens next.

Humorous, compassionate, and wise, Anxious People is an ingeniously constructed story about the enduring power of friendship, forgiveness, and hope—the things that save us, even in the most anxious of times."
contemporary,The Vanishing Half,by Brit Bennett (Goodreads Author),343 pages,https://www.goodreads.com/book/show/51791252-the-vanishing-half,4.29,"#1 NEW YORK TIMES BESTSELLER

LONGLISTED FOR THE NATIONAL BOOK AWARD

A GOOD MORNING AMERICA Book Club Pick

From The New York Times-bestselling author of The Mothers, a stunning new novel about twin sisters, inseparable as children, who ultimately choose to live in two very different worlds, one black and one white.

The Vignes twin sisters will always be identical. But after growing up together in a small, southern black community and running away at age sixteen, it's not just the shape of their daily lives that is different as adults, it's everything: their families, their communities, their racial identities. Many years later, one sister lives with her black daughter in the same southern town she once tried to escape. The other secretly passes for white, and her white husband knows nothing of her past. Still, even separated by so many miles and just as many lies, the fates of the twins remain intertwined. What will happen to the next generation, when their own daughters' storylines intersect?

Weaving together multiple strands and generations of this family, from the Deep South to California, from the 1950s to the 1990s, Brit Bennett produces a story that is at once a riveting, emotional family story and a brilliant exploration of the American history of passing. Looking well beyond issues of race, The Vanishing Half considers the lasting influence of the past as it shapes a person's decisions, desires, and expectations, and explores some of the multiple reasons and realms in which people sometimes feel pulled to live as something other than their origins.

As with her New York Times-bestselling debut The Mothers, Brit Bennett offers an engrossing page-turner about family and relationships that is immersive and provocative, compassionate and wise."
contemporary,Nobody Knows,by Lani Lynn Vale (Goodreads Author),204 pages,https://www.goodreads.com/book/show/49135183-nobody-knows,4.51,"All he ever wanted was to matter to someone.
What he didn’t know was that he did matter to someone.
Someone that worried about him every single day that he was gone.

Malachi Gabriel Gnocchi was missing for two years. Thanks to a mission gone wrong, not only had he been captured, but his best friend along with his fellow teammates had been taken, too.

He spent two years in hell, hoping and praying that one day he’d get to go home.

And one day he does. Only, he isn’t the same person that left. Every single thing that made him Malachi is no more.

Sierra started writing to soldiers overseas through the soldier pen pal program when she was in high school. Years later, she had no idea that the one soldier that she’d been paired up with in the very beginning would be the one man that would change her world eight years down the road.

When the letters from her soldier stopped, she knew that something bad had happened.

When they started back up again two years after the last letter, she thought that someone was playing a joke on her.

Only, that joke wasn’t a joke at all.

The man on the other end of those letters is a man that’s dying slowly from the inside out.

He’s a living, breathing, mess and there’s only one thing she can do to help him.

Write him back and hope that she can bring him back from the edge."
contemporary,The Cipher,by Isabella Maldonado (Goodreads Author),332 pages,https://www.goodreads.com/book/show/53966623-the-cipher,4.27,"To a cunning serial killer, she was the one that got away. Until now…

FBI Special Agent Nina Guerrera escaped a serial killer’s trap at sixteen. Years later, when she’s jumped in a Virginia park, a video of the attack goes viral. Legions of new fans are not the only ones impressed with her fighting skills. The man who abducted her eleven years ago is watching. Determined to reclaim his lost prize, he commits a grisly murder designed to pull her into the investigation…but his games are just beginning. And he’s using the internet to invite the public to play along.

His coded riddles may have made him a depraved social media superstar—an enigmatic cyber-ghost dubbed “the Cipher”—but to Nina he’s a monster who preys on the vulnerable. Partnered with the FBI’s preeminent mind hunter, Dr. Jeffrey Wade, who is haunted by his own past, Nina tracks the predator across the country. Clue by clue, victim by victim, Nina races to stop a deadly killer while the world watches."
