genre,title,author,pages,unique_key,average_rating,book_description
historical-fiction,American Dirt,by Jeanine Cummins (Goodreads Author),400 pages,https://www.goodreads.com/book/show/45046527-american-dirt,4.31,"También de este lado hay sueños. On this side, too, there are dreams.

Lydia Quixano Pérez lives in the Mexican city of Acapulco. She runs a bookstore. She has a son, Luca, the love of her life, and a wonderful husband who is a journalist. And while there are cracks beginning to show in Acapulco because of the drug cartels, her life is, by and large, fairly comfortable.

Even though she knows they’ll never sell, Lydia stocks some of her all-time favorite books in her store. And then one day a man enters the shop to browse and comes up to the register with a few books he would like to buy—two of them her favorites. Javier is erudite. He is charming. And, unbeknownst to Lydia, he is the jefe of the newest drug cartel that has gruesomely taken over the city. When Lydia’s husband’s tell-all profile of Javier is published, none of their lives will ever be the same.

Forced to flee, Lydia and eight-year-old Luca soon find themselves miles and worlds away from their comfortable middle-class existence. Instantly transformed into migrants, Lydia and Luca ride la bestia—trains that make their way north toward the United States, which is the only place Javier’s reach doesn’t extend. As they join the countless people trying to reach el norte, Lydia soon sees that everyone is running from something. But what exactly are they running to?"
historical-fiction,The Evening and the Morning,by Ken Follett (Goodreads Author),913 pages,https://www.goodreads.com/book/show/49239093-the-evening-and-the-morning,4.47,"It is 997 CE, the end of the Dark Ages. England is facing attacks from the Welsh in the west and the Vikings in the east. Those in power bend justice according to their will, regardless of ordinary people and often in conflict with the king. Without a clear rule of law, chaos reigns.

In these turbulent times, three characters find their lives intertwined. A young boatbuilder's life is turned upside down when the only home he's ever known is raided by Vikings, forcing him and his family to move and start their lives anew in a small hamlet where he does not fit in. . . . A Norman noblewoman marries for love, following her husband across the sea to a new land, but the customs of her husband's homeland are shockingly different, and as she begins to realize that everyone around her is engaged in a constant, brutal battle for power, it becomes clear that a single misstep could be catastrophic. . . . A monk dreams of transforming his humble abbey into a center of learning that will be admired throughout Europe. And each in turn comes into dangerous conflict with a clever and ruthless bishop who will do anything to increase his wealth and power."
historical-fiction,Mexican Gothic,by Silvia Moreno-Garcia (Goodreads Author),301 pages,https://www.goodreads.com/book/show/53152636-mexican-gothic,3.76,"After receiving a frantic letter from her newly-wed cousin begging for someone to save her from a mysterious doom, Noemí Taboada heads to High Place, a distant house in the Mexican countryside. She’s not sure what she will find—her cousin’s husband, a handsome Englishman, is a stranger, and Noemí knows little about the region.

Noemí is also an unlikely rescuer: She’s a glamorous debutante, and her chic gowns and perfect red lipstick are more suited for cocktail parties than amateur sleuthing. But she’s also tough and smart, with an indomitable will, and she is not afraid: Not of her cousin’s new husband, who is both menacing and alluring; not of his father, the ancient patriarch who seems to be fascinated by Noemí; and not even of the house itself, which begins to invade Noemi’s dreams with visions of blood and doom.

Her only ally in this inhospitable abode is the family’s youngest son. Shy and gentle, he seems to want to help Noemí, but might also be hiding dark knowledge of his family’s past. For there are many secrets behind the walls of High Place. The family’s once colossal wealth and faded mining empire kept them from prying eyes, but as Noemí digs deeper she unearths stories of violence and madness.

And Noemí, mesmerized by the terrifying yet seductive world of High Place, may soon find it impossible to ever leave this enigmatic house behind."
historical-fiction,This Magnificent Dappled Sea,by David Biro (Goodreads Author),255 pages,https://www.goodreads.com/book/show/55522057-this-magnificent-dappled-sea,4.07,"Two strangers—generations and oceans apart—have a chance to save each other in this moving and suspenseful novel about family secrets and the ineffable connections that attach us.

In a small Northern Italian village, nine-year-old Luca Taviano catches a stubborn cold and is subsequently diagnosed with leukemia. His only hope for survival is a bone marrow transplant. After an exhaustive search, a match turns up three thousand miles away in the form of a most unlikely donor: Joseph Neiman, a rabbi in Brooklyn, New York, who is suffering from a debilitating crisis of faith. As Luca’s young nurse, Nina Vocelli, risks her career and races against time to help save the spirited redheaded boy, she uncovers terrible secrets from World War II—secrets that reveal how a Catholic child could have Jewish genes.

Can inheritance be transcended by accidents of love? That is the question at the heart of This Magnificent Dappled Sea, a novel that challenges the idea of identity and celebrates the ties that bind us together."
historical-fiction,The Giver of Stars,by Jojo Moyes (Goodreads Author),388 pages,https://www.goodreads.com/book/show/43925876-the-giver-of-stars,4.28,"From the author of Me Before You, set in Depression-era America, a breathtaking story of five extraordinary women and their remarkable journey through the mountains of Kentucky and beyond.

Alice Wright marries handsome American Bennett Van Cleve hoping to escape her stifling life in England. But small-town Kentucky quickly proves equally claustrophobic, especially living alongside her overbearing father-in-law. So when a call goes out for a team of women to deliver books as part of Eleanor Roosevelt’s new traveling library, Alice signs on enthusiastically.

The leader, and soon Alice’s greatest ally, is Margery, a smart-talking, self-sufficient woman who’s never asked a man’s permission for anything. They will be joined by three other singular women who become known as the Packhorse Librarians of Kentucky.

What happens to them–and to the men they love–becomes an unforgettable drama of loyalty, justice, humanity and passion. These heroic women refuse to be cowed by men or by convention. And though they face all kinds of dangers in a landscape that is at times breathtakingly beautiful, at others brutal, they’re committed to their job: bringing books to people who have never had any, arming them with facts that will change their lives.

Based on a true story rooted in America’s past, The Giver of Stars is unparalleled in its scope and epic in its storytelling. Funny, heartbreaking, enthralling, it is destined to become a modern classic–a richly rewarding novel of women’s friendship, of true love, and of what happens when we reach beyond our grasp for the great beyond."
historical-fiction,The Dutch House,by Ann Patchett,337 pages,https://www.goodreads.com/book/show/44318414-the-dutch-house,4.12,"At the end of the Second World War, Cyril Conroy combines luck and a single canny investment to begin an enormous real estate empire, propelling his family from poverty to enormous wealth. His first order of business is to buy the Dutch House, a lavish estate in the suburbs outside of Philadelphia. Meant as a surprise for his wife, the house sets in motion the undoing of everyone he loves.

The story is told by Cyril’s son Danny, as he and his older sister, the brilliantly acerbic and self-assured Maeve, are exiled from the house where they grew up by their stepmother. The two wealthy siblings are thrown back into the poverty their parents had escaped from and find that all they have to count on is one another. It is this unshakable bond between them that both saves their lives and thwarts their futures.

Set over the course of five decades, The Dutch House is a dark fairy tale about two smart people who cannot overcome their past. Despite every outward sign of success, Danny and Maeve are only truly comfortable when they’re together. Throughout their lives, they return to the well-worn story of what they’ve lost with humor and rage. But when at last they’re forced to confront the people who left them behind, the relationship between an indulged brother and his ever-protective sister is finally tested."
historical-fiction,The Tattooist of Auschwitz,by Heather Morris (Goodreads Author),262 pages,https://www.goodreads.com/book/show/38359036-the-tattooist-of-auschwitz,4.25,"In April 1942, Lale Sokolov, a Slovakian Jew, is forcibly transported to the concentration camps at Auschwitz-Birkenau. When his captors discover that he speaks several languages, he is put to work as a Tätowierer (the German word for tattooist), tasked with permanently marking his fellow prisoners.

Imprisoned for more than two and a half years, Lale witnesses horrific atrocities and barbarism—but also incredible acts of bravery and compassion. Risking his own life, he uses his privileged position to exchange jewels and money from murdered Jews for food to keep his fellow prisoners alive.

One day in July 1942, Lale, prisoner 32407, comforts a trembling young woman waiting in line to have the number 34902 tattooed onto her arm. Her name is Gita, and in that first encounter, Lale vows to somehow survive the camp and marry her.

A vivid, harrowing, and ultimately hopeful re-creation of Lale Sokolov's experiences as the man who tattooed the arms of thousands of prisoners with what would become one of the most potent symbols of the Holocaust, The Tattooist of Auschwitz is also a testament to the endurance of love and humanity under the darkest possible conditions."
historical-fiction,Daisy Jones & The Six,by Taylor Jenkins Reid (Goodreads Author),355 pages,https://www.goodreads.com/book/show/40597810-daisy-jones-the-six,4.19,
historical-fiction,The Last Correspondent,by Soraya M. Lane (Goodreads Author),335 pages,https://www.goodreads.com/book/show/53710674-the-last-correspondent,4.13,"When journalist Ella Franks is unmasked as a woman writing under a male pseudonym, she loses her job. But having risked everything to write, she refuses to be silenced and leaps at the chance to become a correspondent in war-torn France.

Already entrenched in the thoroughly male arena of war reporting is feisty American photojournalist Danni Bradford. Together with her best friend and partner, Andy, she is determined to cover the events unfolding in Normandy. And to discover the whereabouts of Andy’s flighty sister, Vogue model Chloe, who has followed a lover into the French Resistance.

When trailblazing efforts turn to tragedy, Danni, Ella and Chloe are drawn together, and soon form a formidable team. Each woman is determined to follow her dreams ‘no matter what’, and to make her voice heard over the noise of war.

Europe is a perilous place, with danger at every turn. They’ll need to rely on each other if they are to get their stories back, and themselves out alive. Will the adventure and love they find be worth the journey of their lives?"
historical-fiction,The Seven Husbands of Evelyn Hugo,by Taylor Jenkins Reid (Goodreads Author),391 pages,https://www.goodreads.com/book/show/32620332-the-seven-husbands-of-evelyn-hugo,4.35,"Aging and reclusive Hollywood movie icon Evelyn Hugo is finally ready to tell the truth about her glamorous and scandalous life.

When she chooses unknown magazine reporter Monique Grant for the job, no one in the journalism community is more astounded than Monique herself. Why her? Why now? Monique is not exactly on top of the world. Her husband, David, has left her, and her career has stagnated. Regardless of why Evelyn has chosen her to write her biography, Monique is determined to use this opportunity to jumpstart her career.

Summoned to Evelyn’s Upper East Side apartment, Monique listens as Evelyn unfurls her story: from making her way to Los Angeles in the 1950s to her decision to leave show business in the late 80s, and, of course, the seven husbands along the way. As Evelyn’s life unfolds—revealing a ruthless ambition, an unexpected friendship, and a great forbidden love—Monique begins to feel a very a real connection to the actress. But as Evelyn’s story catches up with the present, it becomes clear that her life intersects with Monique’s own in tragic and irreversible ways."
historical-fiction,The Book Thief,by Markus Zusak (Goodreads Author),552 pages,https://www.goodreads.com/book/show/41048862-the-book-thief,4.37,"Alternate Cover Edition ISBN 0375831002 (ISBN13: 9780375831003)

Narrated by Death, Markus Zusak's groundbreaking new novel is the story of Liesel Meminger, a young foster girl living outside of Munich in Nazi Germany. Liesel scratches out a meager existence for herself by stealing when she discovers something she can't resist--books. Soon she is stealing books from Nazi boo"
historical-fiction,All the Light We Cannot See,by Anthony Doerr (Goodreads Author),531 pages,https://www.goodreads.com/book/show/25210408-all-the-light-we-cannot-see,4.33,"Librarian note: alternate-cover edition of 9781476746586.

Marie-Laure lives with her father in Paris near the Museum of Natural History, where he works as the master of its thousands of locks. When she is six, Marie-Laure goes blind and her father builds a perfect miniature of their neighborhood so she can memorize it by touch and navigate her way home. When Marie-Laure is"
historical-fiction,Outlander,by Diana Gabaldon (Goodreads Author),850 pages,https://www.goodreads.com/book/show/10964.Outlander,4.23,
historical-fiction,The Help,by Kathryn Stockett (Goodreads Author),630 pages,https://www.goodreads.com/book/show/44768927-the-help,4.46,"Librarian's note: An alternate cover edition can be found here

Three ordinary women are about to take one extraordinary step.

Twenty-two-year-old Skeeter has just returned home after graduating from Ole Miss. She may have a degree, but it is 1962, Mississippi, and her mother will not be happy till Skeeter has a ring on her finger. Skeeter would normally find solace with her"
historical-fiction,The Nightingale,by Kristin Hannah (Goodreads Author),440 pages,https://www.goodreads.com/book/show/21853621-the-nightingale,4.57,"In love we find out who we want to be.
In war we find out who we are.

FRANCE, 1939

In the quiet village of Carriveau, Vianne Mauriac says good-bye to her husband, Antoine, as he heads for the Front. She doesn’t believe that the Nazis will invade France…but invade they do, in droves of marching soldiers, in caravans of trucks and tanks, in planes that fill the skies and drop bombs upon the innocent. When a German captain requisitions Vianne’s home, she and her daughter must live with the enemy or lose everything. Without food or money or hope, as danger escalates all around them, she is forced to make one impossible choice after another to keep her family alive.

Vianne’s sister, Isabelle, is a rebellious eighteen-year-old, searching for purpose with all the reckless passion of youth. While thousands of Parisians march into the unknown terrors of war, she meets Gaëtan, a partisan who believes the French can fight the Nazis from within France, and she falls in love as only the young can…completely. But when he betrays her, Isabelle joins the Resistance and never looks back, risking her life time and again to save others.

With courage, grace and powerful insight, bestselling author Kristin Hannah captures the epic panorama of World War II and illuminates an intimate part of history seldom seen: the women’s war. The Nightingale tells the stories of two sisters, separated by years and experience, by ideals, passion and circumstance, each embarking on her own dangerous path toward survival, love, and freedom in German-occupied, war-torn France—a heartbreakingly beautiful novel that celebrates the resilience of the human spirit and the durability of women. It is a novel for everyone, a novel for a lifetime."
historical-fiction,The Pillars of the Earth,by Ken Follett (Goodreads Author),976 pages,https://www.goodreads.com/book/show/5043.The_Pillars_of_the_Earth,4.31,"Ken Follett is known worldwide as the master of split-second suspense, but his most beloved and bestselling book tells the magnificent tale of a twelfth-century monk driven to do the seemingly impossible: build the greatest Gothic cathedral the world has ever known.

Everything readers expect from Follett is here: intrigue, fast-paced action, and passionate romance. But what"
historical-fiction,Memoirs of a Geisha,by Arthur Golden,503 pages,https://www.goodreads.com/book/show/929.Memoirs_of_a_Geisha,4.12,
historical-fiction,The Other Boleyn Girl,by Philippa Gregory (Goodreads Author),670 pages,https://www.goodreads.com/book/show/48722935-the-other-boleyn-girl,4.07,"Two sisters competing for the greatest prize: The love of a king

When Mary Boleyn comes to court as an innocent girl of fourteen, she catches the eye of Henry VIII. Dazzled, Mary falls in love with both her golden prince and her growing role as unofficial queen. However, she soon realises just how much she is a pawn in her family's ambitious plots as the king's interest beg"
historical-fiction,The Guernsey Literary and Potato Peel Pie Society,"by Mary Ann Shaffer, Annie Barrows",291 pages,https://www.goodreads.com/book/show/39832183-the-guernsey-literary-and-potato-peel-pie-society,4.17,
historical-fiction,To Kill a Mockingbird,by Harper Lee,324 pages,https://www.goodreads.com/book/show/2657.To_Kill_a_Mockingbird,4.28,
historical-fiction,Gone with the Wind,by Margaret Mitchell,1037 pages,https://www.goodreads.com/book/show/18405.Gone_with_the_Wind,4.30,"Scarlett O'Hara, the beautiful, spoiled daughter of a well-to-do Georgia plantation owner, must use every means at her disposal to claw her way out of the poverty she finds herself in after Sherman's March to the Sea."
historical-fiction,Between Shades of Gray,by Ruta Sepetys (Goodreads Author),344 pages,https://www.goodreads.com/book/show/7824322-between-shades-of-gray,4.36,
historical-fiction,Girl with a Pearl Earring,by Tracy Chevalier (Goodreads Author),233 pages,https://www.goodreads.com/book/show/2865.Girl_with_a_Pearl_Earring,3.89,
historical-fiction,Wolf Hall,by Hilary Mantel (Goodreads Author),604 pages,https://www.goodreads.com/book/show/7826803-wolf-hall,3.87,
historical-fiction,Dragonfly in Amber,by Diana Gabaldon (Goodreads Author),963 pages,https://www.goodreads.com/book/show/5364.Dragonfly_in_Amber,4.32,
genre,title,author,pages,unique_key,average_rating,book_description
historical-fiction,The Once and Future Witches,by Alix E. Harrow (Goodreads Author),528 pages,https://www.goodreads.com/book/show/49504061-the-once-and-future-witches,4.19,"In 1893, there's no such thing as witches. There used to be, in the wild, dark days before the burnings began, but now witching is nothing but tidy charms and nursery rhymes. If the modern woman wants any measure of power, she must find it at the ballot box.

But when the Eastwood sisters--James Juniper, Agnes Amaranth, and Beatrice Belladonna--join the suffragists of New Salem, they begin to pursue the forgotten words and ways that might turn the women's movement into the witch's movement. Stalked by shadows and sickness, hunted by forces who will not suffer a witch to vote-and perhaps not even to live-the sisters will need to delve into the oldest magics, draw new alliances, and heal the bond between them if they want to survive.

There's no such thing as witches. But there will be."
historical-fiction,The Devil and the Dark Water,by Stuart Turton (Goodreads Author),463 pages,https://www.goodreads.com/book/show/51854625-the-devil-and-the-dark-water,3.99,"A murder on the high seas. A detective duo. A demon who may or may not exist.

It's 1634 and Samuel Pipps, the world's greatest detective, is being transported to Amsterdam to be executed for a crime he may, or may not, have committed. Travelling with him is his loyal bodyguard, Arent Hayes, who is determined to prove his friend innocent.

But no sooner are they out to sea than devilry begins to blight the voyage. A twice-dead leper stalks the decks. Strange symbols appear on the sails. Livestock is slaughtered.

And then three passengers are marked for death, including Samuel.

Could a demon be responsible for their misfortunes?

With Pipps imprisoned, only Arent can solve a mystery that connects every passenger onboard. A mystery that stretches back into their past and now threatens to sink the ship, killing everybody on board.

The breathtaking new novel from Stuart Turton, author of the The 7 1/2 Deaths of Evelyn Hardcastle, winner of the Costa Best First Novel Award."
historical-fiction,Kingdom of the Wicked,by Kerri Maniscalco (Goodreads Author),448 pages,https://www.goodreads.com/book/show/52735921-kingdom-of-the-wicked,4.17,"Two sisters.

One brutal murder.

A quest for vengeance that will unleash Hell itself…

And an intoxicating romance.

Emilia and her twin sister Vittoria are streghe – witches who live secretly among humans, avoiding notice and persecution. One night, Vittoria misses dinner service at the family’s renowned Sicilian restaurant. Emilia soon finds the body of her beloved twin…desecrated beyond belief. Devastated, Emilia sets out to find her sister’s killer and to seek vengeance at any cost-even if it means using dark magic that’s been long forbidden.

Then Emilia meets Wrath, one of the Wicked-princes of Hell she has been warned against in tales since she was a child. Wrath claims to be on Emilia’s side, tasked by his master with solving the series of women’s murders on the island. But when it comes to the Wicked, nothing is as it seems…"
historical-fiction,Plain Bad Heroines,"by Emily M. Danforth (Goodreads Author), Sara Lautman (Illustrations)",608 pages,https://www.goodreads.com/book/show/50496875-plain-bad-heroines,3.85,"A highly imaginative and original horror-comedy centered around a cursed New England boarding school for girls—a wickedly whimsical celebration of the art of storytelling, sapphic love, and the rebellious female spirit.

Our story begins in 1902, at The Brookhants School for Girls. Flo and Clara, two impressionable students, are obsessed with each other and with a daring young writer named Mary MacLane, the author of a scandalous bestselling memoir. To show their devotion to Mary, the girls establish their own private club and call it The Plain Bad Heroine Society. They meet in secret in a nearby apple orchard, the setting of their wildest happiness and, ultimately, of their macabre deaths. This is where their bodies are later discovered with a copy of Mary’s book splayed beside them, the victims of a swarm of stinging, angry yellow jackets. Less than five years later, The Brookhants School for Girls closes its doors forever—but not before three more people mysteriously die on the property, each in a most troubling way.

Over a century later, the now abandoned and crumbling Brookhants is back in the news when wunderkind writer, Merritt Emmons, publishes a breakout book celebrating the queer, feminist history surrounding the “haunted and cursed” Gilded-Age institution. Her bestselling book inspires a controversial horror film adaptation starring celebrity actor and lesbian it girl Harper Harper playing the ill-fated heroine Flo, opposite B-list actress and former child star Audrey Wells as Clara. But as Brookhants opens its gates once again, and our three modern heroines arrive on set to begin filming, past and present become grimly entangled—or perhaps just grimly exploited—and soon it’s impossible to tell where the curse leaves off and Hollywood begins.

A story within a story within a story and featuring black-and-white period illustrations, Plain Bad Heroines is a devilishly haunting, modern masterwork of metafiction that manages to combine the ghostly sensibility of Sarah Waters with the dark imagination of Marisha Pessl and the sharp humor and incisive social commentary of Curtis Sittenfeld into one laugh-out-loud funny, spellbinding, and wonderfully luxuriant read."
historical-fiction,Ring Shout,by P. Djèlí Clark,192 pages,https://www.goodreads.com/book/show/49247242-ring-shout,4.25,"Nebula, Locus, and Alex Award-winner P. Djèlí Clark returns with Ring Shout, a dark fantasy historical novella that gives a supernatural twist to the Ku Klux Klan's reign of terror.

D. W. Griffith is a sorcerer, and The Birth of a Nation is a spell that drew upon the darkest thoughts and wishes from the heart of America. Now, rising in power and prominence, the Klan has a plot to unleash Hell on Earth.

Luckily, Maryse Boudreaux has a magic sword and a head full of tales. When she's not running bootleg whiskey through Prohibition Georgia, she's fighting monsters she calls ""Ku Kluxes."" She's damn good at it, too. But to confront this ongoing evil, she must journey between worlds to face nightmares made flesh--and her own demons. Together with a foul-mouthed sharpshooter and a Harlem Hellfighter, Maryse sets out to save a world from the hate that would consume it."
